yearns to its source. the spirit thirsts for god,
that wisdom's lips seemed borrowing friendship's heart.
the oil upon the puddles dries
snows hide his shoulders; from beneath his chin
when the glance hast lost its beam;
best gems of nature's cabinet,
as round some giant hive, all day and night,
whether they met on festal eve, in field,
who cometh over the hills,
in the shadow of the shores; as dead leaves wake,
touch it: the marble eyelids are not wet--
oh, say, is he, the eternal, there?
the blessed memory of thy worth
from his own tripod, and his holy tree;
i sate down beneath the beech
a million torches lighted by thy hand
thy sleep makes ridiculous.
whose potent unity and concentric force
of peace? it is thy father's name. thy life
now, if thou art a poet, tell me not
who stood in expectation by,
mine eyes were of their madness half beguiled,
jes heavy 'nough to turn a scale thet's doubtfle the wrong way,
you sha' n't roll yo' eyes at me.
case dey nevah tech a drouf.
it will be spring again.
mine are calm and tranquil days,
sang as little children sing;
the things it wrought on; i believe
from flight, seditious angel, to receave
what once has been and ne'er shall be again,
sky, marsh, my soul, and yonder sail.
thy merited reward, the first assay
except in france; and when it’s found in france,
for the greek must ask elsewhere.
whose anvil's even din
that truthful teacup, our dictator, knows;
when hills are free from snow
uttering bare truth, even so as foes commend.
endu'd with human voice and human sense,
whatever anybody had
is passed, and our aereal speed suspended.
afar the melancholy thunder moaned,
their hate, and selfishness, and pride!
i would don my hose of homespun gray,
an hundred silken cords are set
i have lost the urban ways.
and sorrowful to-day, thy children set
or by some cabin door, a bush
was freedom's home or glory's grave!
save for a cry that echoes shrill
with its close-curling gold, and love revived.
a golden helm his front and head surrounds
but, through the war-cloud, pray to thee
swing, like a ship at anchor, roun' my base,
for peace or rest too well he saw
from her stately place on high.
that passed with you and me.--
sweet hope!
for high, and yet more high, the murmurs swell
let those whom nature hath not made for store,
said, `pass not, so cold, these manifold
the adulterate death of lucrece and her groom.
whilst this....
"the snow that husheth all,
then pausing, thus his prophecy renews:
to accomplish suicide.
early or late? or shall that commonwealth
he plays a little, sings a song,
each by his fiery torture howl and rave,
and twitter, and again are still.
my daily thoughts perpetual converse held
yon trunk had thrice a hundred rings,
is lovely round; a beautiful river there
take heed (dear heart) of this large privilege,
at once comes tumbling down the rocky wall;
sat mournfully guarding their corpses there,
low in supplication bending.
twas when you stole my maidenhead;
"sorry?  of course you are, though you compress,
i would not live alway
the king ordains their entrance, and ascends
very sleepy with the silence.
which clanged along the mountain's marble brow--
it steam in winter like an ox's breath,
in prosperous days. like a dim, waning lamp
jarr'd his own golden region; and before
flood his black hearthstone till its flames expire,
when high i heap it with the weed
the climax of those hopes and duties dear
wait his returning strength.
strove to raise itself in blessing,
nile shall pursue his changeless way:
i must be home by noon-time with the cart.'
both the unseen and the seen;
the poet comes the last!
with many sighs;
where, all the long and lone daylight,
full of the calm that cometh after sleep:
men said, into a smile which guile portended,
still sigurd rides with the brethren, as oft in the other days,
was she not somewhat that he could not rule
gnossian his shafts, and lycian was his bow:
you didn't stop for fuss,--
deaf, and dumb, and blind, and cold,
i'm here--so far--and starting on again.
a different man was brother timothy,
see! neptune’s altars minister their brands:
to match your wit against the maker's will,
absently fingering and touching it,
three hours the first november dawn
ran ever clearer speech than that did run
"i say it's someone passing."
the visual nerve is withered to the root,
"what hope wouldst thou hope, o sigurd, ere we kiss, we twain, and depart?"
there is nothing to hope for, i am tired,
i left the place with all my might, --
let dat cradle swing,
he has no calling and he owns no trade.
as they were loosened by that hermit old,